{
  "$schema": "https://json-schema.org/draft/2020-12/schema",
  "$id": "brief.schema.json",
  "title": "AI OS Feature Brief",
  "type": "object",
  "additionalProperties": false,
  "required": ["work_id", "title", "outcome", "users", "scope", "acceptance_criteria", "unresolved_questions", "approval"],
  "properties": {
    "work_id": {"type": "string", "minLength": 1},
    "title": {"type": "string", "minLength": 1},
    "outcome": {"type": "string", "minLength": 1},
    "users": {"type": "array", "minItems": 1, "items": {"type": "string", "minLength": 1}},
    "scope": {
      "type": "object",
      "additionalProperties": false,
      "required": ["in", "out"],
      "properties": {
        "in": {"type": "array", "minItems": 1, "items": {"type": "string"}},
        "out": {"type": "array", "items": {"type": "string"}}
      }
    },
    "acceptance_criteria": {
      "type": "array",
      "minItems": 1,
      "items": {
        "type": "object",
        "additionalProperties": false,
        "required": ["id", "given", "when", "then"],
        "properties": {
          "id": {"type": "string", "pattern": "^AC-[0-9]+$"},
          "given": {"type": "string", "minLength": 1},
          "when": {"type": "string", "minLength": 1},
          "then": {"type": "string", "minLength": 1}
        }
      }
    },
    "constraints": {"type": "array", "items": {"type": "string"}},
    "dependencies": {"type": "array", "items": {"type": "string"}},
    "risks": {"type": "array", "items": {"type": "string"}},
    "unresolved_questions": {
      "type": "array",
      "items": {
        "type": "object",
        "additionalProperties": false,
        "required": ["question", "blocking"],
        "properties": {
          "question": {"type": "string", "minLength": 1},
          "blocking": {"type": "boolean"}
        }
      }
    },
    "approval": {
      "type": "object",
      "additionalProperties": false,
      "required": ["status", "by", "at", "reason"],
      "properties": {
        "status": {"type": "string", "enum": ["pending", "approved", "rejected"]},
        "by": {"type": "string"},
        "at": {"type": "string"},
        "reason": {"type": "string"}
      }
    }
  }
}
